[
  {
    "chunk_id": "fb0000",
    "doc_rank": 1,
    "doc_sha256": "s1",
    "kind": "fallback",
    "path_hint": "fallback",
    "score": 0.0,
    "source_rank": 1,
    "text": "PIRML Fixture Page Deterministic Fixture This fixture body is used for offline web substrate tests.",
    "url": "https://example.com/p"
  }
]